{
  "id": "P-001",
  "version": "1.0.0",
  "last_updated": "2026-10-29T00:00:00+05:30",
  "name": "Boardwallah",
  "tutor_name": "Kunal Rai",
  "qualifications": ["B.Tech Computer Science", "Lead Engineer at Samsung", "Consultant at HCL"],
  "experience_years": 20,
  "teaching_mode": ["home_visit"],
  "boards": ["CBSE"],
  "classes": [10],
  "subjects": ["maths", "science", "social_science", "english", "hindi"],
  "languages": ["English", "Hindi"],
  "service_localities": ["Gaur City 2", "VVIP Homes"],
  "availability": {
    "timezone": "Asia/Kolkata",
    "days": ["mon", "tue", "wed", "thu", "fri", "sat"],
    "window": "16:00-20:00"
  },
  "contact": {
    "whatsapp": "+919911566229",
    "email": "[business email]"
  },
  "trial": {
    "available": true,
    "duration_minutes": 60,
    "fee_paise": 0,
    "currency": "INR"
  },
  "policies": {
    "refund": "See /policies/cancellation-refund.md",
    "cancellation": "Trials: up to 4 hours before start. Paid plans: see policy.",
    "privacy_url": "https://[your-domain]/privacy"
  }
}
